{
  "version": 1,
  "id": "964ea3c8-20fc-5627-a3c6-f912ec4af2ac",
  "storage_name": "main_story",
  "display_name": "主线",
  "revision": 2,
  "created_at": 1790077145960,
  "updated_at": 1790329650721,
  "contexts": [
    {
      "context_entry_id": "33169ab8-e258-556b-87a7-e53aa3afa39c",
      "context_id": "90a916f4-ea13-5bc6-b4d9-097587f5567c"
    },
    {
      "context_entry_id": "22fe875e-6c4d-5e62-9b71-ab4a9b7f459e",
      "context_id": "83ec09e0-58d8-50bb-8fa2-1a4b4317d379"
    },
    {
      "context_entry_id": "92852179-d2df-5f08-976b-429d2d0ac759",
      "context_id": "209b8771-2baf-5985-b7c9-f88bee23ba06"
    },
    {
      "context_entry_id": "bdb62f71-89ad-5feb-b98c-7f983cb528fa",
      "context_id": "640c5e11-3461-50b9-b378-18e86a061f47"
    },
    {
      "context_entry_id": "5fbd029b-4c04-5553-98f8-c26608747c50",
      "context_id": "e6eb5418-a35c-58b4-99c1-7a8e0b756bb9"
    },
    {
      "context_entry_id": "0da4f022-5d82-59d8-92ee-2045228a4c0d",
      "context_id": "ad5495f9-99de-5be7-9d49-d49671d2881e"
    },
    {
      "context_entry_id": "4b152f6b-fab0-5c77-8530-341276e935e2",
      "context_id": "bf1c4b20-f0b0-5090-97e5-da7c94ba0e67"
    },
    {
      "context_entry_id": "4eb5113d-8043-50a5-b689-5d7c4db294dd",
      "context_id": "715f7225-a69c-5269-a630-68bcfea4c67f"
    },
    {
      "context_entry_id": "8e8f96b8-dc1e-5ee4-9e6b-adcaa1b9a3eb",
      "context_id": "b7d3dd7e-bc8c-5023-9e85-f7dea04ea167"
    },
    {
      "context_entry_id": "a73a54eb-3bf9-5584-b5d9-bb549f44e141",
      "context_id": "c2e95ee4-b9b7-571d-b927-ef49502f4c81"
    },
    {
      "context_entry_id": "83332f55-310d-5cad-8393-f6d75369f09b",
      "context_id": "21847efa-6b7f-57e3-8e44-02946936c6bf"
    },
    {
      "context_entry_id": "af16df5d-9709-55cd-85f1-28fd55e28aba",
      "context_id": "68c5cf04-b3e5-5b44-a601-b1b81222e8d5"
    },
    {
      "context_entry_id": "2e4687c5-b820-5ad4-af19-fedb3bcd8578",
      "context_id": "709932fd-aa9f-5369-a4b7-cd6bef0a0240"
    },
    {
      "context_entry_id": "16a39139-c27b-5a1a-b06c-af5cd80f2f49",
      "context_id": "d0e5c1fb-dc9e-5464-b37f-dd348e4b942f"
    },
    {
      "context_entry_id": "7cdf337c-1171-5e92-84df-72b5f118ffcd",
      "context_id": "466f313c-7c6a-5fdb-91a5-fdf028f740bf"
    },
    {
      "context_entry_id": "468c4e93-9453-5b5a-bf39-98f1fb9e740b",
      "context_id": "ce8d58a1-83ed-5145-84cd-aae74edd582b"
    }
  ],
  "summary": {
    "zh-cn": {
      "manual": {
        "text": "失忆的主人公被召到与二十三处异界相连的东京，在使魔沙罗门引导下获得拥有“离断”权能的剑形神器，结识志朗、健吾、良太与冬治，并由物部匡真接纳进入神宿学园。主人公在新宿、池袋与青山的冲突中逐渐理解：神器承载来自异界的记忆，不同权能的矛盾会引发例外处理；契约与序列既能约束战斗，也能成为解除灾害的办法。伙伴们成立新宿召唤师公会，在与各地公会的交往中选择接纳彼此，而主人公体内被不同转光生认出的放逐者记忆始终是谜。\n\n六本木的大君争夺撒托古亚及接近游戏管理员的机会，俄菲翁对主人公体内故人的执念又引发新的例外处理。召唤师与盟友平息冲突，冬治和哈奴曼加入伙伴。随后，大手町屠戮者利用记忆、影魔与公会间的敌意发动袭击，志朗被犹格索托斯的记忆控制；主人公在各地结下的关系使多个公会共同参与救援。大手町决战进一步揭开不死见学园实验与东京游戏的轮回：主人公在过去循环中反复死于与自己结缘的人之手，世界代理人则保留记忆、争夺各自世界的存续。阿鲁克获得新的同伴，召唤师拒绝以主人公的牺牲作为游戏的既定结局。\n\n冲突由地区公会扩展到真三大公会及世界代理人之间。好战者选择性传播过去轮回的杀戮记忆，使人因恐惧与罪疚服从战争。主人公与阿鲁克在蒲田拒绝让旧记忆决定彼此的未来，又与沙罗门重新确认各自的意愿，获得所罗门戒指。物部失踪后，众人深入练马军狱，击败泰兹卡特里波卡，却发现老师的记忆被拆分、身体濒临崩溃。池袋与歌舞伎町的战争中，摩诃迦罗借戒指与湿婆结合，巴特罗企图以其暴走和落月推动战争升级。召唤师与盟友阻止毁灭，取回部分物部记忆，得知老师曾是“全之例外处理·所罗门”在东京活动的写身。主人公开始寻找剩余记忆，物部则希望学生能够走出循环、迎来毕业。\n\n秋叶原事件公开了主人公曾主动选择来到东京的记忆，使既有的身份判断和阵营关系动摇。艾萨克随后推动集合精神革命，试图融合东京多数居民、消除序列与战争，却引发阵营内部的分裂。主人公、良太和同伴们帮助被漫长轮回折磨的世界代理人面对失落与伤痛；意识复制也无法保证原有自我的延续，革命最终暂缓。与此同时，有乐町演艺家与东的立法者联手，通过剥离角色让人消失于舞台背后。营救行动揭出新宿肢体失踪案与主人公未来身体的联系，也揭露物部作为监视者越过规则、直接干涉主人公的往事。“全”的所罗门与“零”的奥弗罗德相遇后，有乐町陷入危机，立法者则带走东京本地居民，准备以未来记忆重塑他们。\n\n主人公与公会同盟深入未来都市救援。三藏的神器拒绝未来记忆移植，奥扬科彭发现异常后紧急停止手术、切断设施能源；这一例外说明，看见未来并不等于必须服从它。米迦勒在主人公身上看见兄长的身影，天照则重叠了弟弟须佐之男的形象，两人都必须面对自己的选择。十人的神器与权能相连，引发世界例外处理“塞菲罗特”；众人在危机中重新确定序列，阻止 M×OTHER 当场夺走主人公，并找回物部最后一份记忆。所罗门与物部匡真曾是两位一体，所罗门还承载过往循环中物部的记忆；沙罗门则是另一个角色，是称物部为父亲的使魔。当前轮回的匡真最终脱离所罗门端末，以独立人类身份回到神宿学园。\n\n第16章进一步揭示，东京游戏由所罗门、未来乌托邦的世界代理人 M×OTHER 与新拉博拉托利共同推动。匡真由不同时点的两个所罗门结合而生，既是王的克隆，也是其子，不能仅以复制品解释他的身份。以其基因培育的人工天才要求他继续担任监视者，他却坚持以物部匡真的身份选择未来。未来的新生命逐渐与东京重叠，主人公和盟友突入巴比伦塔，营救被另一时点的自己带走的胡佛，并与其他时间线的英雄交战。此后主人公进入东京第二十四区，见到旧人类被当作可替换的生体零件，并卷入卡斯特罗的放逐选举及爱丽丝、柴郡猫维系梦境的抉择。新拉博拉托利最终展示以主人公历次轮回为样本制造的人工伪神，企图用可自我繁殖的系统取代旧人类。人工生存圈暂时保护众人，但第二十四区开始向第二十三区坠落；轮回尚未终结，主人公与同伴仍需争取能够自行选择的未来。",
        "updated_at": 1790329650721
      }
    }
  }
}
